{
  "kind": "pgfplot",
  "title": "g(r)=GM/r^2",
  "x": {"min": 6.3e6, "max": 4.0e7, "ticks": 6, "label": "$r\\,(m)$"},
  "y": {"min": 0, "max": 10, "ticks": 6, "label": "$g\\,(m\\,s^{-2})$"},
  "expr": "G*M/x^2",
  "params": {"G": 6.674e-11, "M": 5.972e24},
  "style": {"grid": true, "samples": 201}
}
